mysql> show databases;
+--------------------+
| Database           |
+--------------------+
| College            |
| Lab_works          |
| constraints        |
| foreignKey         |
| information_schema |
| mysql              |
| performance_schema |
| school_mangagement |
| students           |
| sys                |
+--------------------+
10 rows in set (0.01 sec)

mysql> use school_mangagement;
Reading table information for completion of table and column names
You can turn off this feature to get a quicker startup with -A

Database changed
mysql> show tables;
+------------------------------+
| Tables_in_school_mangagement |
+------------------------------+
| student_class                |
| students                     |
+------------------------------+
2 rows in set (0.01 sec)

mysql> desc student_class;
+------------+-------------+------+-----+---------+----------------+
| Field      | Type        | Null | Key | Default | Extra          |
+------------+-------------+------+-----+---------+----------------+
| id         | int         | NO   | PRI | NULL    | auto_increment |
| student_id | int         | NO   | MUL | NULL    |                |
| class      | int         | NO   |     | NULL    |                |
| status     | varchar(20) | NO   |     | NULL    |                |
+------------+-------------+------+-----+---------+----------------+
4 rows in set (0.00 sec)

mysql> create view std as select class, status from student_class where class is 7;
ERROR 1064 (42000): You have an error in your SQL syntax; check the manual that corresponds to your MySQL server version for the right syntax to use near '7' at line 1
mysql> create view std as select class, status from student_class where class= 7;
Query OK, 0 rows affected (0.01 sec)

mysql> select * from std;
+-------+--------+
| class | status |
+-------+--------+
|     7 | ACTIVE |
|     7 | ACTIVE |
+-------+--------+
2 rows in set (0.00 sec)

mysql> desc std;
+--------+-------------+------+-----+---------+-------+
| Field  | Type        | Null | Key | Default | Extra |
+--------+-------------+------+-----+---------+-------+
| class  | int         | NO   |     | NULL    |       |
| status | varchar(20) | NO   |     | NULL    |       |
+--------+-------------+------+-----+---------+-------+
2 rows in set (0.01 sec)

mysql> rename table std to hasan;
Query OK, 0 rows affected (0.01 sec)

mysql> select * from hasan;
+-------+--------+
| class | status |
+-------+--------+
|     7 | ACTIVE |
|     7 | ACTIVE |
+-------+--------+
2 rows in set (0.00 sec)

mysql> insert into hasan values ("avan","evan");
ERROR 1366 (HY000): Incorrect integer value: 'avan' for column 'class' at row 1
mysql> use college;
ERROR 1049 (42000): Unknown database 'college'
mysql> use College;
Reading table information for completion of table and column names
You can turn off this feature to get a quicker startup with -A

Database changed
mysql> shoe tables;
ERROR 1064 (42000): You have an error in your SQL syntax; check the manual that corresponds to your MySQL server version for the right syntax to use near 'shoe tables' at line 1
mysql> show tables;
+-------------------+
| Tables_in_College |
+-------------------+
| DDT               |
| Hostellers        |
| bank              |
| crick             |
| football          |
| join_1            |
| join_2            |
| student_1         |
| student_2         |
| studentsData      |
| students_1        |
+-------------------+
11 rows in set (0.00 sec)

mysql> use students;
Reading table information for completion of table and column names
You can turn off this feature to get a quicker startup with -A

Database changed
mysql> show tables;
+--------------------+
| Tables_in_students |
+--------------------+
| FirstName          |
| info               |
| information        |
+--------------------+
3 rows in set (0.00 sec)

mysql> desc info;
+---------+-------------+------+-----+---------+-------+
| Field   | Type        | Null | Key | Default | Extra |
+---------+-------------+------+-----+---------+-------+
| id      | int         | NO   | PRI | NULL    |       |
| Roll_no | int         | NO   |     | NULL    |       |
| name    | varchar(20) | YES  |     | No name |       |
| age     | tinyint     | YES  |     | NULL    |       |
+---------+-------------+------+-----+---------+-------+
4 rows in set (0.01 sec)

mysql> create view info_1 as select name, age from info where age is 19;
ERROR 1064 (42000): You have an error in your SQL syntax; check the manual that corresponds to your MySQL server version for the right syntax to use near '19' at line 1
mysql> select * from info;
Empty set (0.00 sec)

mysql> insert into info values(1, 101, "Venkat", 18);
Query OK, 1 row affected (0.00 sec)

mysql> select * from info;
+----+---------+--------+------+
| id | Roll_no | name   | age  |
+----+---------+--------+------+
|  1 |     101 | Venkat |   18 |
+----+---------+--------+------+
1 row in set (0.00 sec)

mysql> create view info_1 as select name, age from info where age is 18;
ERROR 1064 (42000): You have an error in your SQL syntax; check the manual that corresponds to your MySQL server version for the right syntax to use near '18' at line 1
mysql> create view info_1 as select name, age from info where age= 18;
Query OK, 0 rows affected (0.01 sec)

mysql> select * from info_1;
+--------+------+
| name   | age  |
+--------+------+
| Venkat |   18 |
+--------+------+
1 row in set (0.00 sec)

mysql> insert into info_1 values(1);
ERROR 1136 (21S01): Column count doesn't match value count at row 1
mysql> insert into info_1 values("hi");
ERROR 1136 (21S01): Column count doesn't match value count at row 1
mysql> insert into info_1 values("hi",2);
ERROR 1423 (HY000): Field of view 'students.info_1' underlying table doesn't have a default value
mysql> insert into info_1 values(2, "Sugu");
ERROR 1366 (HY000): Incorrect integer value: 'Sugu' for column 'age' at row 1
mysql> insert into info_1 values("Sugu", 19);
ERROR 1423 (HY000): Field of view 'students.info_1' underlying table doesn't have a default value
mysql> insert into info_1 values(1, 102, "Sugu", 19);
ERROR 1136 (21S01): Column count doesn't match value count at row 1
mysql> insert into info_1 values("Sugu", 19);
ERROR 1423 (HY000): Field of view 'students.info_1' underlying table doesn't have a default value
mysql> insert into info_1 (name, age)values("Sugu", 19);
ERROR 1423 (HY000): Field of view 'students.info_1' underlying table doesn't have a default value
mysql> insert into info_1 (name, age) values("Sugu", 19);
ERROR 1423 (HY000): Field of view 'students.info_1' underlying table doesn't have a default value
mysql> insert into info_1 (age) values("Sugu", 19);
ERROR 1136 (21S01): Column count doesn't match value count at row 1
mysql> insert into info_1 (name,age) values("Sugu", 19);
ERROR 1423 (HY000): Field of view 'students.info_1' underlying table doesn't have a default value
mysql> insert into view info_1 values(name,age) values("Sugu", 19);
ERROR 1064 (42000): You have an error in your SQL syntax; check the manual that corresponds to your MySQL server version for the right syntax to use near 'info_1 values(name,age) values("Sugu", 19)' at line 1
mysql> insert into view info_1 values("Sugu", 19);
ERROR 1064 (42000): You have an error in your SQL syntax; check the manual that corresponds to your MySQL server version for the right syntax to use near 'info_1 values("Sugu", 19)' at line 1
mysql> insert into info_1 values("Sugu", 19);
ERROR 1423 (HY000): Field of view 'students.info_1' underlying table doesn't have a default value
mysql> insert into info_1 values ("Sugu", 19);
ERROR 1423 (HY000): Field of view 'students.info_1' underlying table doesn't have a default value
mysql> desc info_1;
+-------+-------------+------+-----+---------+-------+
| Field | Type        | Null | Key | Default | Extra |
+-------+-------------+------+-----+---------+-------+
| name  | varchar(20) | YES  |     | No name |       |
| age   | tinyint     | YES  |     | NULL    |       |
+-------+-------------+------+-----+---------+-------+
2 rows in set (0.00 sec)

mysql> alter table info modify name varchar(20) not null;
Query OK, 0 rows affected (0.12 sec)
Records: 0  Duplicates: 0  Warnings: 0

mysql> desc info_1;
+-------+-------------+------+-----+---------+-------+
| Field | Type        | Null | Key | Default | Extra |
+-------+-------------+------+-----+---------+-------+
| name  | varchar(20) | NO   |     | NULL    |       |
| age   | tinyint     | YES  |     | NULL    |       |
+-------+-------------+------+-----+---------+-------+
2 rows in set (0.01 sec)

mysql> insert into info_1 values ("Sugu", 19);
ERROR 1423 (HY000): Field of view 'students.info_1' underlying table doesn't have a default value
mysql> alter table info alter name drop default;
Query OK, 0 rows affected (0.02 sec)
Records: 0  Duplicates: 0  Warnings: 0

mysql> desc info_1;
+-------+-------------+------+-----+---------+-------+
| Field | Type        | Null | Key | Default | Extra |
+-------+-------------+------+-----+---------+-------+
| name  | varchar(20) | NO   |     | NULL    |       |
| age   | tinyint     | YES  |     | NULL    |       |
+-------+-------------+------+-----+---------+-------+
2 rows in set (0.00 sec)

mysql> insert into info_1 values ("Sugu", 19);
ERROR 1423 (HY000): Field of view 'students.info_1' underlying table doesn't have a default value
mysql> insert into info_1 values("Sugu", 19);
ERROR 1423 (HY000): Field of view 'students.info_1' underlying table doesn't have a default value
mysql> create table user(id int primary name not null auto_increment, name varchar(20) not null);
ERROR 1064 (42000): You have an error in your SQL syntax; check the manual that corresponds to your MySQL server version for the right syntax to use near 'name not null auto_increment, name varchar(20) not null)' at line 1
mysql> create table user(id int primary key not null auto_increment, name varchar(20) not null);
Query OK, 0 rows affected (0.05 sec)

mysql> create table batch(id int primary key not null auto_increment, name varchar(20) not null);
Query OK, 0 rows affected (0.05 sec)

mysql> create table course(id int primary key not null auto_increment, name varchar(20) not null);
Query OK, 0 rows affected (0.05 sec)

mysql> insert into user(1, "Surya"),(2, "Dhaya");
ERROR 1064 (42000): You have an error in your SQL syntax; check the manual that corresponds to your MySQL server version for the right syntax to use near '1, "Surya"),(2, "Dhaya")' at line 1
mysql> insert into user values(1, "Surya"),(2, "Dhaya");
Query OK, 2 rows affected (0.01 sec)
Records: 2  Duplicates: 0  Warnings: 0

mysql> insert into batch values(1, "Batch1"),(2, "Batch2");
Query OK, 2 rows affected (0.01 sec)
Records: 2  Duplicates: 0  Warnings: 0

mysql> insert into course values(1, "HTML"),(2, "CSS"),(3, "JS");
Query OK, 3 rows affected (0.01 sec)
Records: 3  Duplicates: 0  Warnings: 0

mysql> select * from user;
+----+-------+
| id | name  |
+----+-------+
|  1 | Surya |
|  2 | Dhaya |
+----+-------+
2 rows in set (0.00 sec)

mysql> select * from batch;
+----+--------+
| id | name   |
+----+--------+
|  1 | Batch1 |
|  2 | Batch2 |
+----+--------+
2 rows in set (0.00 sec)

mysql> select * from course;
+----+------+
| id | name |
+----+------+
|  1 | HTML |
|  2 | CSS  |
|  3 | JS   |
+----+------+
3 rows in set (0.00 sec)

mysql> create table batch_users(id int primary key not null auto_increment, batch_id int not null, user_id int not null, foreign key batch_id references batch(id), foreign key user_id references user(id));
ERROR 1064 (42000): You have an error in your SQL syntax; check the manual that corresponds to your MySQL server version for the right syntax to use near 'references batch(id), foreign key user_id references user(id))' at line 1
mysql> create table batch_users(id int primary key not null auto_increment, batch_id int not null, user_id int not null, foreign key (batch_id) references batch(id), foreign key (user_id) references user(id));
Query OK, 0 rows affected (0.07 sec)

mysql> insert into batch_users values(1, 1, 1),(2, 2, 2);
Query OK, 2 rows affected (0.01 sec)
Records: 2  Duplicates: 0  Warnings: 0

mysql> select * from batch_users;
+----+----------+---------+
| id | batch_id | user_id |
+----+----------+---------+
|  1 |        1 |       1 |
|  2 |        2 |       2 |
+----+----------+---------+
2 rows in set (0.01 sec)

mysql> insert into batch_users values(1, 1, 1);
ERROR 1062 (23000): Duplicate entry '1' for key 'batch_users.PRIMARY'
mysql> insert into user values(3, "Chitra"),(4, "Selvi");
Query OK, 2 rows affected (0.00 sec)
Records: 2  Duplicates: 0  Warnings: 0

mysql> insert into batch_users values(3, 2, 3);
Query OK, 1 row affected (0.00 sec)

mysql> select * from batch_users;
+----+----------+---------+
| id | batch_id | user_id |
+----+----------+---------+
|  1 |        1 |       1 |
|  2 |        2 |       2 |
|  3 |        2 |       3 |
+----+----------+---------+
3 rows in set (0.00 sec)

mysql> select user.id, batch_user.user_id from batch_users inner join user on user.id = batch.id;
ERROR 1054 (42S22): Unknown column 'batch_user.user_id' in 'field list'
mysql> select user.id, batch_users.user_id from batch_users inner join user on user.id = batch.id;
ERROR 1054 (42S22): Unknown column 'batch.id' in 'on clause'
mysql> select user.id, batch_users.user_id from batch_users inner join user using(id);
+----+---------+
| id | user_id |
+----+---------+
|  1 |       1 |
|  2 |       2 |
|  3 |       3 |
+----+---------+
3 rows in set (0.00 sec)

mysql> select user.id, batch.name from batch_users inner join user using(id);
ERROR 1054 (42S22): Unknown column 'batch.name' in 'field list'
mysql> select user.id, batch.name from batch_users inner join batch using(id);
ERROR 1054 (42S22): Unknown column 'user.id' in 'field list'
mysql> select batch_users.user_id, batch.name from batch_users inner join batch using(id);
+---------+--------+
| user_id | name   |
+---------+--------+
|       1 | Batch1 |
|       2 | Batch2 |
+---------+--------+
2 rows in set (0.00 sec)

mysql> select batch_users.user_id, batch.name from batch_users left join batch using(id);
+---------+--------+
| user_id | name   |
+---------+--------+
|       1 | Batch1 |
|       2 | Batch2 |
|       3 | NULL   |
+---------+--------+
3 rows in set (0.00 sec)

mysql> select user.id, user.name, batch.name from user inner join batch using(id);
+----+-------+--------+
| id | name  | name   |
+----+-------+--------+
|  1 | Surya | Batch1 |
|  2 | Dhaya | Batch2 |
+----+-------+--------+
2 rows in set (0.00 sec)

mysql> select user.id,batch_users.batch_id,batch.name from user,batch,batch_users;
+----+----------+--------+
| id | batch_id | name   |
+----+----------+--------+
|  1 |        2 | Batch1 |
|  1 |        2 | Batch2 |
|  1 |        2 | Batch1 |
|  1 |        2 | Batch2 |
|  1 |        1 | Batch1 |
|  1 |        1 | Batch2 |
|  2 |        2 | Batch1 |
|  2 |        2 | Batch2 |
|  2 |        2 | Batch1 |
|  2 |        2 | Batch2 |
|  2 |        1 | Batch1 |
|  2 |        1 | Batch2 |
|  3 |        2 | Batch1 |
|  3 |        2 | Batch2 |
|  3 |        2 | Batch1 |
|  3 |        2 | Batch2 |
|  3 |        1 | Batch1 |
|  3 |        1 | Batch2 |
|  4 |        2 | Batch1 |
|  4 |        2 | Batch2 |
|  4 |        2 | Batch1 |
|  4 |        2 | Batch2 |
|  4 |        1 | Batch1 |
|  4 |        1 | Batch2 |
+----+----------+--------+
24 rows in set (0.01 sec)

mysql> select batch_users.user_id,batch.name,user.name from user join batch using(id) join batch_users using(id);
+---------+--------+-------+
| user_id | name   | name  |
+---------+--------+-------+
|       1 | Batch1 | Surya |
|       2 | Batch2 | Dhaya |
+---------+--------+-------+
2 rows in set (0.00 sec)

mysql> insert into user values(3, "Chitra"),(4, "Selvi");
ERROR 1062 (23000): Duplicate entry '3' for key 'user.PRIMARY'
mysql> select * from user;
+----+--------+
| id | name   |
+----+--------+
|  1 | Surya  |
|  2 | Dhaya  |
|  3 | Chitra |
|  4 | Selvi  |
+----+--------+
4 rows in set (0.00 sec)

mysql> insert into batch values(3, "batch1"),(4, "batch1");
Query OK, 2 rows affected (0.00 sec)
Records: 2  Duplicates: 0  Warnings: 0

mysql> select * from batch;
+----+--------+
| id | name   |
+----+--------+
|  1 | Batch1 |
|  2 | Batch2 |
|  3 | batch1 |
|  4 | batch1 |
+----+--------+
4 rows in set (0.00 sec)

mysql> select course.id,course.name,batch.id,batch.name,user.id,user.name from course join batch using(id) join user using(id);
+----+------+----+--------+----+--------+
| id | name | id | name   | id | name   |
+----+------+----+--------+----+--------+
|  1 | HTML |  1 | Batch1 |  1 | Surya  |
|  2 | CSS  |  2 | Batch2 |  2 | Dhaya  |
|  3 | JS   |  3 | batch1 |  3 | Chitra |
+----+------+----+--------+----+--------+
3 rows in set (0.00 sec)

mysql> select course.id,course.name,batch.id,batch.name,user.id,user.name from course join batch using(id) join user using(id) where course.name = "HTML";
+----+------+----+--------+----+-------+
| id | name | id | name   | id | name  |
+----+------+----+--------+----+-------+
|  1 | HTML |  1 | Batch1 |  1 | Surya |
+----+------+----+--------+----+-------+
1 row in set (0.00 sec)

mysql> insert into course values(4, "HTML");
Query OK, 1 row affected (0.01 sec)

mysql> insert into batch values(5, "batch2");
Query OK, 1 row affected (0.00 sec)

mysql> insert into user values(5, "Naresh");
Query OK, 1 row affected (0.01 sec)

mysql> select course.id,course.name,batch.id,batch.name,user.id,user.name from course join batch using(id) join user using(id) where course.name = "HTML";
+----+------+----+--------+----+-------+
| id | name | id | name   | id | name  |
+----+------+----+--------+----+-------+
|  1 | HTML |  1 | Batch1 |  1 | Surya |
|  4 | HTML |  4 | batch1 |  4 | Selvi |
+----+------+----+--------+----+-------+
2 rows in set (0.00 sec)

mysql> select course.id,course.name,batch.id,batch.name,user.id,user.name from course join batch using(id) join user using(id) where course.name = "HTML" and batch.name = "batch1";
+----+------+----+--------+----+-------+
| id | name | id | name   | id | name  |
+----+------+----+--------+----+-------+
|  1 | HTML |  1 | Batch1 |  1 | Surya |
|  4 | HTML |  4 | batch1 |  4 | Selvi |
+----+------+----+--------+----+-------+
2 rows in set (0.00 sec)

mysql> select*from user;
+----+--------+
| id | name   |
+----+--------+
|  1 | Surya  |
|  2 | Dhaya  |
|  3 | Chitra |
|  4 | Selvi  |
|  5 | Naresh |
+----+--------+
5 rows in set (0.00 sec)

mysql> select*from batch;
+----+--------+
| id | name   |
+----+--------+
|  1 | Batch1 |
|  2 | Batch2 |
|  3 | batch1 |
|  4 | batch1 |
|  5 | batch2 |
+----+--------+
5 rows in set (0.00 sec)

mysql> select*from course;
+----+------+
| id | name |
+----+------+
|  1 | HTML |
|  2 | CSS  |
|  3 | JS   |
|  4 | HTML |
+----+------+
4 rows in set (0.00 sec)

mysql> insert into course(name) values('HTML');
Query OK, 1 row affected (0.01 sec)

mysql> select course.id,course.name,batch.id,batch.name,user.id,user.name from course join batch using(id) join user using(id) where course.name = "HTML" and batch.name = "batch1";
+----+------+----+--------+----+-------+
| id | name | id | name   | id | name  |
+----+------+----+--------+----+-------+
|  1 | HTML |  1 | Batch1 |  1 | Surya |
|  4 | HTML |  4 | batch1 |  4 | Selvi |
+----+------+----+--------+----+-------+
2 rows in set (0.00 sec)

mysql> update batch set name='batch1' where id=5;
Query OK, 1 row affected (0.01 sec)
Rows matched: 1  Changed: 1  Warnings: 0

mysql> select course.id,course.name,batch.id,batch.name,user.id,user.name from course join batch using(id) join user using(id) where course.name = "HTML" and batch.name = "batch1";
+----+------+----+--------+----+--------+
| id | name | id | name   | id | name   |
+----+------+----+--------+----+--------+
|  1 | HTML |  1 | Batch1 |  1 | Surya  |
|  4 | HTML |  4 | batch1 |  4 | Selvi  |
|  5 | HTML |  5 | batch1 |  5 | Naresh |
+----+------+----+--------+----+--------+
3 rows in set (0.00 sec)

mysql> select course.name,user.name,user.id from course join batch using(id) join user using(id) where course.name is "HTML";
ERROR 1064 (42000): You have an error in your SQL syntax; check the manual that corresponds to your MySQL server version for the right syntax to use near '"HTML"' at line 1
mysql> select course.name,user.name,user.id from course join batch using(id) join user using(id) where course.name = "HTML";
+------+--------+----+
| name | name   | id |
+------+--------+----+
| HTML | Surya  |  1 |
| HTML | Selvi  |  4 |
| HTML | Naresh |  5 |
+------+--------+----+
3 rows in set (0.00 sec)

mysql> select course.name,user.name from course join batch using(id) join user using(id) where course.name = "HTML";
+------+--------+
| name | name   |
+------+--------+
| HTML | Surya  |
| HTML | Selvi  |
| HTML | Naresh |
+------+--------+
3 rows in set (0.00 sec)

mysql> select course.name,user.name from course join batch using(id) join user using(id);
+------+--------+
| name | name   |
+------+--------+
| HTML | Surya  |
| CSS  | Dhaya  |
| JS   | Chitra |
| HTML | Selvi  |
| HTML | Naresh |
+------+--------+
5 rows in set (0.00 sec)

mysql> select course.name,user.name, count(*) from course join batch using(id) join user using(id) order by course.name;
ERROR 1140 (42000): In aggregated query without GROUP BY, expression #1 of SELECT list contains nonaggregated column 'students.course.name'; this is incompatible with sql_mode=only_full_group_by
mysql> select course.name,user.name, count(*) from course join batch using(id) join user using(id) group by name;
ERROR 1052 (23000): Column 'name' in group statement is ambiguous
mysql> select course.name,user.name, count(*) from course join batch using(id) join user using(id) group by user.name;
ERROR 1055 (42000): Expression #1 of SELECT list is not in GROUP BY clause and contains nonaggregated column 'students.course.name' which is not functionally dependent on columns in GROUP BY clause; this is incompatible with sql_mode=only_full_group_by
mysql> select course.name,user.name from course join batch using(id) join user using(id) group by user.name;
ERROR 1055 (42000): Expression #1 of SELECT list is not in GROUP BY clause and contains nonaggregated column 'students.course.name' which is not functionally dependent on columns in GROUP BY clause; this is incompatible with sql_mode=only_full_group_by
mysql> select course.name,user.name from course join batch using(id) join user using(id);
+------+--------+
| name | name   |
+------+--------+
| HTML | Surya  |
| CSS  | Dhaya  |
| JS   | Chitra |
| HTML | Selvi  |
| HTML | Naresh |
+------+--------+
5 rows in set (0.00 sec)

mysql> select course.name,count(user.name) from course join batch using(id) join user using(id);
ERROR 1140 (42000): In aggregated query without GROUP BY, expression #1 of SELECT list contains nonaggregated column 'students.course.name'; this is incompatible with sql_mode=only_full_group_by
mysql> select course.name,count(user.name) from course join batch using(id) join user using(id) having count(user.name)>1;
ERROR 1140 (42000): In aggregated query without GROUP BY, expression #1 of SELECT list contains nonaggregated column 'students.course.name'; this is incompatible with sql_mode=only_full_group_by
mysql> select course.name,user.name from course join batch using(id) join user using(id) having count(user.name)>1;
ERROR 1140 (42000): In aggregated query without GROUP BY, expression #1 of SELECT list contains nonaggregated column 'students.course.name'; this is incompatible with sql_mode=only_full_group_by
mysql> select course.name,user.name from course join batch using(id) join user using(id) having count(user.name)>1
